{
  "id": "anatomy.region.ca1",
  "type": "BrainRegion",
  "name": "CA1",
  "description": "Example subregion record.",
  "aliases": [
    "Cornu Ammonis 1"
  ],
  "parent_regions": [
    "anatomy.region.hippocampus"
  ],
  "hemisphere": "bilateral",
  "anatomical_class": "subcortex",
  "atlas_memberships": [
    "atlas.reference_human_v1"
  ],
  "spatial_representations": [],
  "evidence_refs": [],
  "version": "0.1.0",
  "status": "draft"
}
