{
  "id": "anatomy.region.hippocampus",
  "type": "BrainRegion",
  "name": "Hippocampus",
  "description": "MVP example record; scientific content requires source review before publication.",
  "aliases": [
    "hippocampal formation"
  ],
  "parent_regions": [
    "anatomy.region.medial_temporal_region"
  ],
  "hemisphere": "bilateral",
  "anatomical_class": "subcortex",
  "atlas_memberships": [
    "atlas.reference_human_v1"
  ],
  "spatial_representations": [
    "spatial.hippocampus.reference_human_v1"
  ],
  "evidence_refs": [
    "evidence.example.hippocampus"
  ],
  "version": "0.1.0",
  "status": "draft"
}
